{
  "meta_version": "2.0",
  "meta_scope": "functions",
  "script": {
    "name": "print_area_scope_analysis.py",
    "path": "D:/codex-tasks/cad/scripts/drawing_basic_service/print/print_area_scope_analysis.py",
    "encoding": "utf-8",
    "version": "2026-03-21.print-meta-v1"
  },
  "functions_procedure": {
    "goal": "描述 print_area_scope_analysis.py 中每个函数在打印主链中的步骤骨架。",
    "step_style": "graded",
    "public_api": [
      "analyze_pseudo_maximal_scopes",
      "filter_jobs_by_largest_pseudo_scope",
      "run_scope_analysis_case",
      "main"
    ]
  },
  "functions": [
    {
      "name": "_normalize_path",
      "signature": "def _normalize_path(path: str | Path) -> str:",
      "level": "utility",
      "role": "归一化路径字符串，保证文档匹配、打开和关闭逻辑使用统一格式。",
      "preconditions": [],
      "failure_paths": [
        "输入形态不满足预期时返回空结果、False 或抛出异常。"
      ],
      "success_conditions": [
        "局部结果可被同脚本主流程继续使用。"
      ],
      "must_keep_experience": [],
      "evidence": {
        "line_start": 34,
        "line_end": 35
      },
      "brief_flow": [
        "读取局部输入。",
        "执行当前 helper 逻辑。",
        "返回局部结果或通过副作用服务主流程。"
      ]
    },
    {
      "name": "_is_name_only_target",
      "signature": "def _is_name_only_target(target_path: str | Path) -> bool:",
      "level": "utility",
      "role": "判断输入目标是否只有文件名，用于兼容仅按文档名定位的场景。",
      "preconditions": [],
      "failure_paths": [
        "输入形态不满足预期时返回空结果、False 或抛出异常。"
      ],
      "success_conditions": [
        "局部结果可被同脚本主流程继续使用。"
      ],
      "must_keep_experience": [],
      "evidence": {
        "line_start": 38,
        "line_end": 40
      },
      "brief_flow": [
        "读取局部输入。",
        "执行当前 helper 逻辑。",
        "返回局部结果或通过副作用服务主流程。"
      ]
    },
    {
      "name": "_find_document_by_path",
      "signature": "def _find_document_by_path(target_path: str | Path):",
      "level": "utility",
      "role": "按路径或名称在当前 CAD 会话中定位目标文档。",
      "preconditions": [
        "当前 CAD 会话应可访问目标文档或文档名。"
      ],
      "failure_paths": [
        "目标文档定位失败时只能返回空值、False 或抛出异常。"
      ],
      "success_conditions": [
        "局部结果可被同脚本主流程继续使用。"
      ],
      "must_keep_experience": [],
      "evidence": {
        "line_start": 43,
        "line_end": 57
      },
      "brief_flow": [
        "读取局部输入。",
        "执行当前 helper 逻辑。",
        "返回局部结果或通过副作用服务主流程。"
      ]
    },
    {
      "name": "_activate_document_by_path",
      "signature": "def _activate_document_by_path(target_path: str | Path, retries: int=8, delay: float=0.5) -> bool:",
      "level": "utility",
      "role": "按路径激活目标文档，并在必要时等待文档成为当前活动文档。",
      "preconditions": [
        "当前 CAD 会话应可访问目标文档或文档名。"
      ],
      "failure_paths": [
        "目标文档定位失败时只能返回空值、False 或抛出异常。"
      ],
      "success_conditions": [
        "局部结果可被同脚本主流程继续使用。"
      ],
      "must_keep_experience": [],
      "evidence": {
        "line_start": 60,
        "line_end": 85
      },
      "brief_flow": [
        "读取局部输入。",
        "执行当前 helper 逻辑。",
        "返回局部结果或通过副作用服务主流程。"
      ]
    },
    {
      "name": "_close_document_by_path",
      "signature": "def _close_document_by_path(target_path: str | Path, save_changes: bool=False) -> bool:",
      "level": "utility",
      "role": "按路径关闭目标文档，减少后续调度对会话的干扰。",
      "preconditions": [
        "当前 CAD 会话应可访问目标文档或文档名。"
      ],
      "failure_paths": [
        "目标文档定位失败时只能返回空值、False 或抛出异常。"
      ],
      "success_conditions": [
        "局部结果可被同脚本主流程继续使用。"
      ],
      "must_keep_experience": [],
      "evidence": {
        "line_start": 88,
        "line_end": 96
      },
      "brief_flow": [
        "读取局部输入。",
        "执行当前 helper 逻辑。",
        "返回局部结果或通过副作用服务主流程。"
      ]
    },
    {
      "name": "_area_from_bbox",
      "signature": "def _area_from_bbox(bbox: tuple[float, float, float, float]) -> float:",
      "level": "utility",
      "role": "提供局部辅助步骤、转换或兼容逻辑，服务同脚本主流程。",
      "preconditions": [],
      "failure_paths": [
        "输入形态不满足预期时返回空结果、False 或抛出异常。"
      ],
      "success_conditions": [
        "局部结果可被同脚本主流程继续使用。"
      ],
      "must_keep_experience": [],
      "evidence": {
        "line_start": 99,
        "line_end": 100
      },
      "brief_flow": [
        "读取局部输入。",
        "执行当前 helper 逻辑。",
        "返回局部结果或通过副作用服务主流程。"
      ]
    },
    {
      "name": "analyze_pseudo_maximal_scopes",
      "signature": "def analyze_pseudo_maximal_scopes() -> dict[str, Any]:",
      "level": "core",
      "role": "围绕输入对象执行分析流程，并输出结构化结果。",
      "preconditions": [],
      "failure_paths": [
        "输入形态不满足预期时返回空结果、False 或抛出异常。"
      ],
      "success_conditions": [
        "返回结果可被上层流程直接消费。"
      ],
      "must_keep_experience": [
        "返回结构应与上层 plan/job/summary 消费接口保持兼容。"
      ],
      "evidence": {
        "line_start": 103,
        "line_end": 137
      },
      "steps": [
        "读取输入对象或候选集合。",
        "执行当前函数负责的分析、匹配或过滤逻辑。",
        "返回供上层继续消费的结果。"
      ]
    },
    {
      "name": "_job_inside_scope",
      "signature": "def _job_inside_scope(job: Any, scope_bbox: tuple[float, float, float, float], tol: float=1.0) -> bool:",
      "level": "utility",
      "role": "提供局部辅助步骤、转换或兼容逻辑，服务同脚本主流程。",
      "preconditions": [],
      "failure_paths": [
        "输入形态不满足预期时返回空结果、False 或抛出异常。"
      ],
      "success_conditions": [
        "局部结果可被同脚本主流程继续使用。"
      ],
      "must_keep_experience": [],
      "evidence": {
        "line_start": 140,
        "line_end": 152
      },
      "brief_flow": [
        "读取局部输入。",
        "执行当前 helper 逻辑。",
        "返回局部结果或通过副作用服务主流程。"
      ]
    },
    {
      "name": "filter_jobs_by_largest_pseudo_scope",
      "signature": "def filter_jobs_by_largest_pseudo_scope(jobs_by_space: dict[str, list[Any]], scope_payload: dict[str, Any]) -> dict[str, Any]:",
      "level": "core",
      "role": "按范围、handle 或条件过滤已有候选集合。",
      "preconditions": [],
      "failure_paths": [
        "输入形态不满足预期时返回空结果、False 或抛出异常。"
      ],
      "success_conditions": [
        "返回结果可被上层流程直接消费。"
      ],
      "must_keep_experience": [
        "返回结构应与上层 plan/job/summary 消费接口保持兼容。"
      ],
      "evidence": {
        "line_start": 155,
        "line_end": 191
      },
      "steps": [
        "读取输入对象或候选集合。",
        "执行当前函数负责的分析、匹配或过滤逻辑。",
        "返回供上层继续消费的结果。"
      ]
    },
    {
      "name": "run_scope_analysis_case",
      "signature": "def run_scope_analysis_case(*, dwg_path: Path, output_path: Path | None=None, keep_open: bool=False) -> dict[str, Any]:",
      "level": "core",
      "role": "执行单次 case 或主链流程，并把结果写入结构化产物。",
      "preconditions": [
        "输入路径、计划或 job 集合应已准备完成。"
      ],
      "failure_paths": [
        "目标文档、计划或外部环境不可用时流程失败。"
      ],
      "success_conditions": [
        "目标产物已生成，且返回 summary、路径或状态对象。"
      ],
      "must_keep_experience": [
        "保持当前主链的顺序组织，不要跳过准备、执行和收尾阶段。"
      ],
      "evidence": {
        "line_start": 194,
        "line_end": 222
      },
      "steps": [
        "校验输入并准备运行上下文。",
        "调用同脚本或相邻模块的核心流程函数。",
        "汇总执行结果并写出结构化产物。"
      ]
    },
    {
      "name": "main",
      "signature": "def main() -> None:",
      "level": "core",
      "role": "提供命令行入口，解析参数后调用主流程。",
      "preconditions": [],
      "failure_paths": [
        "输入形态不满足预期时返回空结果、False 或抛出异常。"
      ],
      "success_conditions": [
        "局部结果可被同脚本主流程继续使用。"
      ],
      "must_keep_experience": [],
      "evidence": {
        "line_start": 225,
        "line_end": 250
      },
      "steps": [
        "解析命令行参数。",
        "把参数整理为主流程所需输入。",
        "调用主流程函数并输出结果。"
      ]
    }
  ],
  "dependencies": {
    "runtime_domains": [
      "cad-com",
      "scope-analysis",
      "print-analysis"
    ],
    "script_focus": "在伪极大矩形候选已知的前提下，判断最终保留的最大伪极大范围，并据此过滤打印 job。"
  },
  "quality": {
    "todo": [
      "steps 为静态骨架摘要，未展开每个 CAD/COM 细节分支。",
      "复杂阈值或外部环境异常处理仍建议结合真实案例进一步人工细化。"
    ],
    "function_count": 11,
    "public_api_count": 4,
    "core_function_count": 4
  }
}
