{
  "meta_version": "2.0",
  "meta_scope": "script",
  "script": {
    "name": "print_verifier.py",
    "path": "D:/codex-tasks/cad/scripts/drawing_basic_service/print/print_verifier.py",
    "encoding": "utf-8",
    "version": "2026-03-21.print-meta-v1"
  },
  "procedure": {
    "goal": "说明 print_verifier.py 在打印主链中的整体工作流。",
    "workflow": [
      "先从 plan/job 提取期望纸张尺寸。",
      "再读取 PDF 实际页面尺寸。",
      "随后按页做误差校验。",
      "最后输出整体验证结果与异常明细。"
    ],
    "applicable_scenarios": [
      "需要校验生成 PDF 的页数与尺寸是否符合计划",
      "需要把校验结果回写到打印 summary"
    ],
    "resource_boundary": [
      "仅负责当前脚本所属阶段，不替代上游目录级治理文档。",
      "涉及 CAD 真机执行时仍需复用 system.licad、CAD_coordination 与打印主链其它模块。"
    ]
  },
  "functions": [
    {
      "name": "_job_value",
      "level": "utility",
      "steps": [
        "读取调用输入并校验关键前提。",
        "执行本脚本负责的核心流程或调用链。",
        "返回结果或写出当前阶段产物。"
      ]
    },
    {
      "name": "_parse_media_size_mm",
      "level": "utility",
      "steps": [
        "读取调用输入并校验关键前提。",
        "执行本脚本负责的核心流程或调用链。",
        "返回结果或写出当前阶段产物。"
      ]
    },
    {
      "name": "_read_pdf_page_sizes_mm",
      "level": "utility",
      "steps": [
        "读取调用输入并校验关键前提。",
        "执行本脚本负责的核心流程或调用链。",
        "返回结果或写出当前阶段产物。"
      ]
    },
    {
      "name": "_verify_page_sizes",
      "level": "utility",
      "steps": [
        "读取调用输入并校验关键前提。",
        "执行本脚本负责的核心流程或调用链。",
        "返回结果或写出当前阶段产物。"
      ]
    },
    {
      "name": "verify_generated_pdfs",
      "level": "core",
      "steps": [
        "读取调用输入并校验关键前提。",
        "执行本脚本负责的核心流程或调用链。",
        "返回结果或写出当前阶段产物。"
      ]
    }
  ],
  "dependencies": {
    "runtime_domains": [
      "pdf",
      "verification"
    ],
    "script_focus": "读取计划中的页面尺寸与生成 PDF 的实际页面尺寸，输出验证结果并标记异常页面。"
  },
  "quality": {
    "todo": [
      "workflow 已覆盖主流程骨架，局部阈值、启发式参数仍需结合案例回归细化。"
    ],
    "function_count": 5,
    "public_api_count": 1
  }
}
