{
  "meta_version": "2.0",
  "meta_scope": "script",
  "script": {
    "name": "print_policy.py",
    "path": "D:/codex-tasks/cad/scripts/drawing_basic_service/print/print_policy.py",
    "encoding": "utf-8",
    "version": "2026-03-21.print-meta-v1"
  },
  "procedure": {
    "goal": "说明 print_policy.py 在打印主链中的整体工作流。",
    "workflow": [
      "先归一打印模式与区域匹配模式。",
      "再收集模型空间与布局空间 job。",
      "随后排序、重排索引并分配输出路径。",
      "最后生成 PrintPlan 并保存为 JSON。"
    ],
    "applicable_scenarios": [
      "需要从打印区域构造 job 列表和 plan.json",
      "需要控制 job 排序和输出命名",
      "需要在已有计划上按 handle 做再过滤"
    ],
    "resource_boundary": [
      "仅负责当前脚本所属阶段，不替代上游目录级治理文档。",
      "涉及 CAD 真机执行时仍需复用 system.licad、CAD_coordination 与打印主链其它模块。"
    ]
  },
  "functions": [
    {
      "name": "PrintPlan.total_jobs",
      "level": "utility",
      "steps": [
        "读取调用输入并校验关键前提。",
        "执行本脚本负责的核心流程或调用链。",
        "返回结果或写出当前阶段产物。"
      ]
    },
    {
      "name": "PrintPlan.landscape_count",
      "level": "utility",
      "steps": [
        "读取调用输入并校验关键前提。",
        "执行本脚本负责的核心流程或调用链。",
        "返回结果或写出当前阶段产物。"
      ]
    },
    {
      "name": "PrintPlan.portrait_count",
      "level": "utility",
      "steps": [
        "读取调用输入并校验关键前提。",
        "执行本脚本负责的核心流程或调用链。",
        "返回结果或写出当前阶段产物。"
      ]
    },
    {
      "name": "_safe_handle",
      "level": "utility",
      "steps": [
        "读取调用输入并校验关键前提。",
        "执行本脚本负责的核心流程或调用链。",
        "返回结果或写出当前阶段产物。"
      ]
    },
    {
      "name": "_get_bbox",
      "level": "utility",
      "steps": [
        "读取调用输入并校验关键前提。",
        "执行本脚本负责的核心流程或调用链。",
        "返回结果或写出当前阶段产物。"
      ]
    },
    {
      "name": "_layout_name_map",
      "level": "utility",
      "steps": [
        "读取调用输入并校验关键前提。",
        "执行本脚本负责的核心流程或调用链。",
        "返回结果或写出当前阶段产物。"
      ]
    },
    {
      "name": "_sanitize_name",
      "level": "utility",
      "steps": [
        "读取调用输入并校验关键前提。",
        "执行本脚本负责的核心流程或调用链。",
        "返回结果或写出当前阶段产物。"
      ]
    },
    {
      "name": "_contains_bbox",
      "level": "utility",
      "steps": [
        "读取调用输入并校验关键前提。",
        "执行本脚本负责的核心流程或调用链。",
        "返回结果或写出当前阶段产物。"
      ]
    },
    {
      "name": "normalize_print_mode",
      "level": "core",
      "steps": [
        "读取调用输入并校验关键前提。",
        "执行本脚本负责的核心流程或调用链。",
        "返回结果或写出当前阶段产物。"
      ]
    },
    {
      "name": "_area_match_mode",
      "level": "utility",
      "steps": [
        "读取调用输入并校验关键前提。",
        "执行本脚本负责的核心流程或调用链。",
        "返回结果或写出当前阶段产物。"
      ]
    },
    {
      "name": "_make_job",
      "level": "utility",
      "steps": [
        "读取调用输入并校验关键前提。",
        "执行本脚本负责的核心流程或调用链。",
        "返回结果或写出当前阶段产物。"
      ]
    },
    {
      "name": "_collect_layout_viewports",
      "level": "utility",
      "steps": [
        "读取调用输入并校验关键前提。",
        "执行本脚本负责的核心流程或调用链。",
        "返回结果或写出当前阶段产物。"
      ]
    },
    {
      "name": "_sort_jobs",
      "level": "utility",
      "steps": [
        "读取调用输入并校验关键前提。",
        "执行本脚本负责的核心流程或调用链。",
        "返回结果或写出当前阶段产物。"
      ]
    },
    {
      "name": "collect_print_jobs",
      "level": "core",
      "steps": [
        "读取调用输入并校验关键前提。",
        "执行本脚本负责的核心流程或调用链。",
        "返回结果或写出当前阶段产物。"
      ]
    },
    {
      "name": "reindex_jobs_by_space",
      "level": "core",
      "steps": [
        "读取调用输入并校验关键前提。",
        "执行本脚本负责的核心流程或调用链。",
        "返回结果或写出当前阶段产物。"
      ]
    },
    {
      "name": "assign_output_paths",
      "level": "core",
      "steps": [
        "读取调用输入并校验关键前提。",
        "执行本脚本负责的核心流程或调用链。",
        "返回结果或写出当前阶段产物。"
      ]
    },
    {
      "name": "filter_jobs_by_handles",
      "level": "core",
      "steps": [
        "读取调用输入并校验关键前提。",
        "执行本脚本负责的核心流程或调用链。",
        "返回结果或写出当前阶段产物。"
      ]
    },
    {
      "name": "build_print_plan",
      "level": "core",
      "steps": [
        "读取调用输入并校验关键前提。",
        "执行本脚本负责的核心流程或调用链。",
        "返回结果或写出当前阶段产物。"
      ]
    },
    {
      "name": "plan_to_dict",
      "level": "core",
      "steps": [
        "读取调用输入并校验关键前提。",
        "执行本脚本负责的核心流程或调用链。",
        "返回结果或写出当前阶段产物。"
      ]
    },
    {
      "name": "save_plan_json",
      "level": "core",
      "steps": [
        "读取调用输入并校验关键前提。",
        "执行本脚本负责的核心流程或调用链。",
        "返回结果或写出当前阶段产物。"
      ]
    }
  ],
  "dependencies": {
    "runtime_domains": [
      "planning",
      "filesystem",
      "print-analysis"
    ],
    "script_focus": "把候选打印区域组织成稳定的 PrintPlan，完成模式归一、排序、路径分配与按 handle 过滤。"
  },
  "quality": {
    "todo": [
      "workflow 已覆盖主流程骨架，局部阈值、启发式参数仍需结合案例回归细化。"
    ],
    "function_count": 20,
    "public_api_count": 8
  }
}
